{
  "$schema": "https://json-schema.org/draft/2020-12/schema",
  "checkout_clean": true,
  "extensions": {},
  "inputs": [
    {
      "bytes": 1606,
      "path": "modules/module_0_foundations/inverter/inverter_tb.sch",
      "sha256": "521464a42c5352cad371a8b091d71d9a083686749ef49c69b3f07ec838a3cb82"
    },
    {
      "bytes": 683,
      "path": "modules/module_0_foundations/inverter/inverter.sym",
      "sha256": "8658fa30ac994a0bedf511e59f064e6458e9b4a30d91382f6974a5117bd5c103"
    },
    {
      "bytes": 715,
      "path": "modules/module_0_foundations/inverter/inverter.sch",
      "sha256": "6a2e03f44df59976b8ba4fca385b104b80802d367789171790bd238f912ec771"
    },
    {
      "bytes": 2738,
      "path": "modules/module_1_bandgap_reference/part_1_OTA/gmid_example/testbenches/ota_testbench.sch",
      "sha256": "81577b238bdd926731d3ef54ba29e35e7f94c51aea91b0e8dd6dfbd8c4fc60c6"
    },
    {
      "bytes": 881,
      "path": "modules/module_1_bandgap_reference/part_1_OTA/gmid_example/schematic/two_stage_OTA.sym",
      "sha256": "d6cbae50c9f6a425bab127f0644c5959c98c13893442420b6b25531af0d64126"
    },
    {
      "bytes": 2175,
      "path": "modules/module_1_bandgap_reference/part_1_OTA/gmid_example/schematic/two_stage_OTA.sch",
      "sha256": "2bfae18e0f02cbf7a2919bd8d219ea2d1edbb32457830365ae4d4965f6a2e232"
    }
  ],
  "license": {
    "bytes": 11357,
    "path": "LICENSE",
    "sha256": "c71d239df91726fc519c6eb72d318ec65820627232b2f796219e87dcf35d0ab4"
  },
  "remote_url_verified": true,
  "repository": "https://github.com/IHP-GmbH/IHP-AnalogAcademy.git",
  "revision": "133ecf657572e021b5921b5a1b7693abfb209623",
  "schema": "openada.design-provenance/v0alpha1",
  "tree": "2a710fd503226e9642e4337a324e6c192a9d8a31"
}
